[
  {"source_id": "epa_2009_manure_tsd", "citation": "US EPA. 2009. Technical Support Document for Manure Management Systems: Proposed Rule for Mandatory Reporting of Greenhouse Gases, 4 Feb 2009. Tables A-2 (B0), A-3 (MCF by annual mean temperature, footnoted 'Source: 2006 IPCC Guidelines'), A-4 (digester collection and destruction efficiency), A-5 (direct N2O EF). Stand-in for IPCC 2019 Ch. 10 Tables 10.16-10.21 until those are read.", "year": 2009, "region_id": "US", "kind": "standard", "role": "primary_data", "doi_or_url": "https://www.epa.gov/sites/production/files/2015-07/documents/tsd_manure_020409.pdf", "license": "US Government work"},
  {"source_id": "epa_ghgi_2017_annex3_11", "citation": "US EPA. 2017. Inventory of U.S. Greenhouse Gas Emissions and Sinks: 1990-2015, Annex 3 Part B, Section 3.11 (Tables A-185 dry-system MCF, A-186 state MCF for liquid systems 2015, A-187 direct N2O EF, A-188 indirect N loss). Read via WebFetch; the 2022 edition's 3.11 could not be extracted.", "year": 2017, "region_id": "US", "kind": "model", "role": "primary_data", "doi_or_url": "https://19january2021snapshot.epa.gov/sites/static/files/2017-02/documents/2017_annex_3-_part_b.pdf", "license": "US Government work"},
  {"source_id": "mpi_nz_2025_ipcc2019", "citation": "Sangster, C. 2025. 2019 Refinement to the 2006 IPCC Guidelines, Vol 4, Chapters 10 and 11. Ministry for Primary Industries (NZ), paper to the Agricultural Inventory Advisory Panel, 30 Oct 2025. Table 4 quotes IPCC 2019 Table 10.22 swine Frac_GasMS. Secondary for IPCC 2019.", "year": 2025, "region_id": "GLO", "kind": "literature", "role": "primary_data", "doi_or_url": "https://www.mpi.govt.nz/dmsdocument/71770-2019-Refinement-to-the-2006-IPCC-Guidelines-for-National-Greenhouse-Gas-Inventories", "license": "NZ Government document"},
  {"source_id": "ipcc_2019_v4_ch11", "citation": "IPCC. 2019. 2019 Refinement to the 2006 IPCC Guidelines, Vol 4 Ch 11, N2O Emissions from Managed Soils. Table 11.3 (EF4, EF5).", "year": 2019, "region_id": "GLO", "kind": "standard", "role": "primary_data", "doi_or_url": "https://www.ipcc-nggip.iges.or.jp/public/2019rf/pdf/4_Volume4/19R_V4_Ch11_Soils_N2O_CO2.pdf", "license": "IPCC open publication"},
  {"source_id": "unfccc_cdm_tool14_2024", "citation": "UNFCCC CDM. 2024. TOOL14: Project and leakage emissions from anaerobic digesters, v03.0 (EB 123 Annex 2). Default CH4 share of biogas 0.6 (Data/Parameter table 1) and physical leakage 0.028 (enclosed digester) or 0.10 (covered lagoon) (Data/Parameter table 3).", "year": 2024, "region_id": "GLO", "kind": "standard", "role": "primary_data", "doi_or_url": "https://cdm.unfccc.int/methodologies/PAmethodologies/tools/am-tool-14-v3.pdf", "license": "UNFCCC open publication"},
  {"source_id": "nrcs_awmfh_ch11_2013", "citation": "USDA NRCS. 2013. National Engineering Handbook Part 651 (AWMFH), Ch 11 Waste Utilization, Table 11-5: nutrients retained by handling system (swine anaerobic lagoon; pits beneath slatted floor).", "year": 2013, "region_id": "US", "kind": "standard", "role": "primary_data", "doi_or_url": "https://directives.nrcs.usda.gov/sites/default/files2/1720533338/Chapter%2011%20-%20Waste%20Utilization.pdf", "license": "US Government work"},
  {"source_id": "nrcs_awmfh_ch4_2008", "citation": "USDA NRCS. 2008. AWMFH Ch 4 Agricultural Waste Characteristics, Table 4-16(a): swine lagoon surface water and sludge composition (adapted from ASAE D384.2 Table 19).", "year": 2008, "region_id": "US", "kind": "standard", "role": "primary_data", "doi_or_url": "https://directives.nrcs.usda.gov/sites/default/files2/1712930943/17165.pdf", "license": "US Government work"},
  {"source_id": "noaa_cag_statewide", "citation": "NOAA NCEI Climate at a Glance, statewide annual precipitation, NC (31) and IA (13); 1991-2020 mean computed from the 30 printed annual values.", "year": 2026, "region_id": "US", "kind": "measured", "role": "primary_data", "doi_or_url": "https://www.ncei.noaa.gov/access/monitoring/climate-at-a-glance/statewide/time-series/", "license": "US Government work"},
  {"source_id": "nrcs_awmfh_app10c_1996", "citation": "USDA NRCS. 1996. AWMFH Ch 10 Appendix 10C, Runoff From Feedlots and Evaporation, Design Example 10C-3: annual free-water-surface evaporation 39 in, Rocky Mount NC.", "year": 1996, "region_id": "NC", "kind": "standard", "role": "primary_data", "doi_or_url": "https://mail.irrigationtoolbox.com/NEH/Part651_AWMFH/awmfh-chap10-app10c.pdf", "license": "US Government work"},
  {"source_id": "dadaser_celik_2008", "citation": "Dadaser-Celik, F., Stefan, H.G. 2008. Lake Evaporation Response to Climate in Minnesota. SAFL Project Report 506 (LCCMR), p. 10: Waseca MN summer lake evaporation 642 mm (0.7 x pan). Proxy for Iowa until an Iowa value is read.", "year": 2008, "region_id": "IA", "kind": "measured", "role": "primary_data", "doi_or_url": "https://www.lccmr.mn.gov/projects/2006/finals/2006_07_appx-d_lake_evaporation.pdf", "license": "open state report"},
  {"source_id": "ncsu_are_2005_b1", "citation": "NCSU Agricultural and Resource Economics (Zering, Wohlgenant et al.). 2005. Smithfield Agreement Phase 2 economic appendices B1a (lagoon design Examples F.1-F.6) and B1b (lagoon and sprayfield baseline, Table AL.5 nutrient mass balance, 4,320-head feeder-finish). Public NC documents (project archive smithfield_agreement/archive/phase2/).", "year": 2005, "region_id": "NC", "kind": "model", "role": "primary_data", "doi_or_url": "smithfield_agreement/archive/phase2/B1a.pdf; B1b.pdf", "license": "public NC document"},
  {"source_id": "iowa_iac_567_65_2020", "citation": "Iowa Administrative Code 567 Ch 65, rule 65.15(14) concrete standards and Appendix D (IAC 1/15/20), applied to a 50 x 192 ft barn pit (Brumm 2016 geometry) to derive concrete and rebar per m3 of storage.", "year": 2020, "region_id": "IA", "kind": "standard", "role": "primary_data", "doi_or_url": "https://iowadnr.gov/media/5840/download", "license": "state rule"},
  {"source_id": "nrcs_practice_lifespan", "citation": "NRCS conservation practice minimum life spans as listed by TSSWCB FY26 Approved Practices and Expected Life (2025): 313 Waste Storage Facility 15 yr, 359 Waste Treatment Lagoon 15 yr, 521 Pond Sealing or Lining (geomembrane) 20 yr.", "year": 2025, "region_id": "US", "kind": "standard", "role": "primary_data", "doi_or_url": "https://tsswcb.texas.gov/sites/default/files/files/programs/water-quality-management-plan/FY26%20Practice%20List%20final.pdf", "license": "state agency publication"},
  {"source_id": "nrcs_cps521_2023", "citation": "USDA NRCS. 2023. Conservation Practice Standard 521, Pond Sealing or Lining, Geomembrane or Geosynthetic Clay Liner, Table 1: HDPE minimum 60 mil for wastewater.", "year": 2023, "region_id": "US", "kind": "standard", "role": "primary_data", "doi_or_url": "https://www.nrcs.usda.gov/sites/default/files/2025-07/521-nhcp-cps-pond-sealing-lining-geomembrane-geosyn.pdf", "license": "US Government work"},
  {"source_id": "omafra_2014_removal", "citation": "Hilborn, D. 2014. Removing Liquid Manure From Storage. OMAFRA Factsheet 14-027: PTO pumps 49-135 kW, agitation 2-8 h per event. Shaft energy per m3 derived for a 39 x 5 m tank.", "year": 2014, "region_id": "CA-ON", "kind": "literature", "role": "primary_data", "doi_or_url": "https://files.ontario.ca/omafra-removing-liquid-manure-from-storage-14-027-en-2022-10-18.pdf", "license": "Ontario government publication"},
  {"source_id": "msu_e1762_1984", "citation": "Gilbertson, C.B. et al. 1984. Pumping Liquid Manure from Swine Lagoons and Holding Ponds. MSU Extension E-1762 (Pork Industry Handbook): engine efficiency 0.25-0.5.", "year": 1984, "region_id": "US", "kind": "literature", "role": "primary_data", "doi_or_url": "https://sanweb.lib.msu.edu/DMC/extension_publications/e1762/e1762-1984.pdf", "license": "open archive copy"},
  {"source_id": "lyons_2021_separation", "citation": "Lyons, G.A. et al. 2021. Review of Two Mechanical Separation Technologies for the Sustainable Management of Agricultural Phosphorus in Nutrient-Vulnerable Zones. Agronomy 11(5):836, CC BY: screw press 0.4-1.2 kWh/t, decanter centrifuge 2.2-5.1 kWh/t.", "year": 2021, "region_id": "GLO", "kind": "literature", "role": "primary_data", "doi_or_url": "https://doi.org/10.3390/agronomy11050836", "license": "CC BY 4.0"},
  {"source_id": "missouri_eq304_tank", "citation": "Li, Z., Lim, T.T. (c. 2022). Application of Aboveground Manure Slurry System as Additional Storage and Solid Separator. Univ. Missouri Extension EQ304 (78 ft x 19 ft glass-fused steel tank), with 3-6 mm plate thickness from a generic GFS specification; steel 4-8 kg per m3 derived.", "year": 2022, "region_id": "US", "kind": "literature", "role": "primary_data", "doi_or_url": "https://extension.missouri.edu/publications/eq304", "license": "open extension publication"},
  {"source_id": "expert_mahmoud_2026", "citation": "Project owner (M. Sharara), thread decisions 2026-10-18: VS destruction in lagoons and digesters 50-75%; deep pits emptied once (fall) or twice (fall and spring) a year; lagoons never emptied.", "year": 2026, "region_id": "US", "kind": "expert_default", "role": "primary_data", "doi_or_url": "project thread", "license": "project record"},
  {"source_id": "assumed_storage", "citation": "Project assumptions for storage where no open value was read: shallow pit depth 2 ft (concrete per m3 recomputed from the Iowa code geometry), HDPE density 940 kg/m3, agitation shaft energy taken as the midpoint of the derived 0.016-0.18 kWh/m3 bound. Flagged for replacement.", "year": 2026, "region_id": "US", "kind": "expert_default", "role": "primary_data", "doi_or_url": "", "license": "project record"}
]
